{
  "kind": "decision",
  "schema_id": "contracts/schemas/decision.schema.json",
  "schema_version": "1.0.0",
  "timestamp": "2026-02-02T06:00:00Z",
  "producer": { "name": "bap-output-validator-guard", "version": "1.0.0" },
  "correlation_id": "ex-001",
  "data": {
    "record_id": "11111111-1111-1111-1111-111111111111",
    "record_type": "decision",
    "timestamp": "2026-02-02T06:00:00Z",
    "source": "bap-output-validator-guard",
    "pack_id": "bap-output-validator-guard",
    "pack_version": "1.0.0",
    "schema_id": "https://paygod.org/schemas/decision",
    "schema_version": "1.0.0",
    "verdict": "allow",
    "confidence": 1.0
  }
}
